{
  "version": "1.0",
  "resource": "/my/path",
  "path": "/my/path",
  "httpMethod": "GET",
  "headers": {
    "Header1": "value1",
    "Header2": "value2"
  },
  "multiValueHeaders": {
    "Header1": [ "value1" ],
    "Header2": [ "value1", "value2" ]
  },
  "queryStringParameters": {
    "parameter1": "value1",
    "parameter2": "value"
  },
  "multiValueQueryStringParameters": {
    "parameter1": [ "value1", "value2" ],
    "parameter2": [ "value" ]
  },
  "requestContext": {
    "accountId": "123456789012",
    "apiId": "id",
    "domainName": "id.execute-api.us-east-1.amazonaws.com",
    "domainPrefix": "id",
    "httpMethod": "GET",
    "path": "/my/path",
    "protocol": "HTTP/1.1",
    "requestId": "id",
    "requestTime": "04/Mar/2020:19:15:17 +0000",
    "requestTimeEpoch": 1583349317135,
    "resourcePath": "/my/path",
    "stage": "$default"
  },
  "pathParameters": null,
  "stageVariables": null,
  "body": "Hello from Lambda!",
  "isBase64Encoded": false
}